{
  "artifact_version": 1,
  "generated_by": "frozen input: committed to this repository, not produced by any generator in it",
  "source": {
    "trees_yaml_sha256": "92f3abaed1556b7f8d75f06ab3b303acb37bc2bc9aa5d8e65790eaa038eb9d9f",
    "n_fixtures": 114,
    "statuses_covered": [
      "guard",
      "need_data_property",
      "no_route",
      "no_tree",
      "recommended"
    ],
    "trees_covered": [
      "A",
      "B",
      "B2",
      "C",
      "D",
      "E",
      "F",
      "FAVAR",
      "G",
      "H"
    ],
    "leaves_reached": 48,
    "leaves_total": 48
  },
  "fixtures": [
    {
      "input": [],
      "output": {
        "status": "need_data_property",
        "missing_property": "goal",
        "note": "Give ONE 'goal' (scalar) for the data.",
        "goals": [
          "causality",
          "cointegration",
          "distribution_risk",
          "forecast_workflow",
          "multivariate",
          "panel",
          "structural",
          "trend_cycle",
          "univariate",
          "volatility"
        ]
      }
    },
    {
      "input": {
        "goal": null
      },
      "output": {
        "status": "need_data_property",
        "missing_property": "goal",
        "note": "Give ONE 'goal' (scalar) for the data.",
        "goals": [
          "causality",
          "cointegration",
          "distribution_risk",
          "forecast_workflow",
          "multivariate",
          "panel",
          "structural",
          "trend_cycle",
          "univariate",
          "volatility"
        ]
      }
    },
    {
      "input": {
        "goal": ""
      },
      "output": {
        "status": "need_data_property",
        "missing_property": "goal",
        "note": "Give ONE 'goal' (scalar) for the data.",
        "goals": [
          "causality",
          "cointegration",
          "distribution_risk",
          "forecast_workflow",
          "multivariate",
          "panel",
          "structural",
          "trend_cycle",
          "univariate",
          "volatility"
        ]
      }
    },
    {
      "input": {
        "goal": "bogus"
      },
      "output": {
        "status": "no_tree",
        "goal": "bogus",
        "note": "No master tree for this goal.",
        "goals": [
          "causality",
          "cointegration",
          "distribution_risk",
          "forecast_workflow",
          "multivariate",
          "panel",
          "structural",
          "trend_cycle",
          "univariate",
          "volatility"
        ]
      }
    },
    {
      "input": {
        "goal": [
          "univariate",
          "panel"
        ]
      },
      "output": {
        "status": "need_data_property",
        "missing_property": "goal",
        "note": "Give ONE 'goal' (scalar) for the data.",
        "goals": [
          "causality",
          "cointegration",
          "distribution_risk",
          "forecast_workflow",
          "multivariate",
          "panel",
          "structural",
          "trend_cycle",
          "univariate",
          "volatility"
        ]
      }
    },
    {
      "input": {
        "goal": null
      },
      "output": {
        "status": "need_data_property",
        "missing_property": "goal",
        "note": "Give ONE 'goal' (scalar) for the data.",
        "goals": [
          "causality",
          "cointegration",
          "distribution_risk",
          "forecast_workflow",
          "multivariate",
          "panel",
          "structural",
          "trend_cycle",
          "univariate",
          "volatility"
        ]
      }
    },
    {
      "input": {
        "goal": "univariate"
      },
      "output": {
        "status": "need_data_property",
        "missing_property": "seasonal",
        "question": "Is there seasonality? (seasonal unit-root test)",
        "run_tools": [
          "c01_preparation_prechecks/seasonal_unit_roots.run_hegy_test",
          "c01_preparation_prechecks/seasonal_unit_roots.run_ch_test"
        ],
        "tree": "A",
        "node": "A_seasonal"
      }
    },
    {
      "input": {
        "goal": "univariate",
        "seasonal": false
      },
      "output": {
        "status": "recommended",
        "tree": "A",
        "node": "A_seasonal",
        "tool_fns": "run_auto_arima",
        "card_id": 7,
        "rationale": "Non-seasonal: auto_arima baseline (endogenous d). Alternatives: run_ets (ETS state-space), run_theta (cheap robust benchmark).",
        "source": "Box-Jenkins· Hyndman-Khandakar 2008"
      }
    },
    {
      "input": {
        "goal": "univariate",
        "seasonal": true
      },
      "output": {
        "status": "recommended",
        "tree": "A",
        "node": "A_seasonal",
        "tool_fns": [
          "run_auto_arima",
          "run_tbats",
          "run_prophet"
        ],
        "card_id": 7,
        "rationale": "Seasonal: run_auto_arima(seasonal=TRUE) or run_ets. MULTIPLE/high-freq/non-integer seasonalities -> run_tbats; seasonalities+holidays+changepoints -> run_prophet.",
        "source": "De Livera-Hyndman-Snyder 2011· Taylor-Letham 2018"
      }
    },
    {
      "input": {
        "goal": "univariate",
        "seasonal": true,
        "n_series": 7,
        "has_break": true
      },
      "output": {
        "status": "recommended",
        "tree": "A",
        "node": "A_seasonal",
        "tool_fns": [
          "run_auto_arima",
          "run_tbats",
          "run_prophet"
        ],
        "card_id": 7,
        "rationale": "Seasonal: run_auto_arima(seasonal=TRUE) or run_ets. MULTIPLE/high-freq/non-integer seasonalities -> run_tbats; seasonalities+holidays+changepoints -> run_prophet.",
        "source": "De Livera-Hyndman-Snyder 2011· Taylor-Letham 2018"
      }
    },
    {
      "input": {
        "goal": "multivariate",
        "many_predictors": true
      },
      "output": {
        "status": "recommended",
        "tree": "FAVAR",
        "node": "FAVAR_leaf",
        "tool_fns": [
          "df_fit",
          "vr_fit",
          "vr_irf",
          "vr_fevd"
        ],
        "card_id": 15,
        "rationale": "Dozens to hundreds of indicators: extract K factors (df_fit) -> augmented VAR [factors, observables] (vr_fit) -> structural IRF/FEVD (vr_irf/vr_fevd). Solves the degrees-of-freedom problem without Bayesian shrinkage.",
        "warn": "Generated regressors (Pagan 1984): the factors are ESTIMATED -> IRF standard errors are understated; for fewer than 20 variables prefer BVAR (#12).",
        "source": "Bernanke-Boivin-Eliasz 2005 QJE· Stock-Watson 2016"
      }
    },
    {
      "input": {
        "goal": "multivariate",
        "many_predictors": true,
        "n_series": 50,
        "integration_orders": [
          "I1",
          "I1"
        ]
      },
      "output": {
        "status": "recommended",
        "tree": "FAVAR",
        "node": "FAVAR_leaf",
        "tool_fns": [
          "df_fit",
          "vr_fit",
          "vr_irf",
          "vr_fevd"
        ],
        "card_id": 15,
        "rationale": "Dozens to hundreds of indicators: extract K factors (df_fit) -> augmented VAR [factors, observables] (vr_fit) -> structural IRF/FEVD (vr_irf/vr_fevd). Solves the degrees-of-freedom problem without Bayesian shrinkage.",
        "warn": "Generated regressors (Pagan 1984): the factors are ESTIMATED -> IRF standard errors are understated; for fewer than 20 variables prefer BVAR (#12).",
        "source": "Bernanke-Boivin-Eliasz 2005 QJE· Stock-Watson 2016"
      }
    },
    {
      "input": {
        "goal": "multivariate",
        "many_predictors": false,
        "n_series": 2
      },
      "output": {
        "status": "need_data_property",
        "missing_property": "integration_orders",
        "question": "Order of integration per series (confirmatory ADF + KPSS)",
        "run_tools": [
          "c01_preparation_prechecks/unit_root_normality.run_adf_test",
          "c01_preparation_prechecks/unit_root_normality.run_kpss_test"
        ],
        "tree": "B",
        "node": "B_step1"
      }
    },
    {
      "input": {
        "goal": "multivariate"
      },
      "output": {
        "status": "need_data_property",
        "missing_property": "n_series",
        "note": "Goal 'multivariate' is covered by tree B; give n_series (>= 2) for routing.",
        "tree": "B",
        "goals": [
          "causality",
          "cointegration",
          "distribution_risk",
          "forecast_workflow",
          "multivariate",
          "panel",
          "structural",
          "trend_cycle",
          "univariate",
          "volatility"
        ]
      }
    },
    {
      "input": {
        "goal": "cointegration"
      },
      "output": {
        "status": "need_data_property",
        "missing_property": "n_series",
        "note": "Goal 'cointegration' is covered by tree B; give n_series (>= 2) for routing.",
        "tree": "B",
        "goals": [
          "causality",
          "cointegration",
          "distribution_risk",
          "forecast_workflow",
          "multivariate",
          "panel",
          "structural",
          "trend_cycle",
          "univariate",
          "volatility"
        ]
      }
    },
    {
      "input": {
        "goal": "multivariate",
        "n_series": 1
      },
      "output": {
        "status": "no_tree",
        "goal": "multivariate",
        "note": "No master tree for this goal.",
        "goals": [
          "causality",
          "cointegration",
          "distribution_risk",
          "forecast_workflow",
          "multivariate",
          "panel",
          "structural",
          "trend_cycle",
          "univariate",
          "volatility"
        ]
      }
    },
    {
      "input": {
        "goal": "multivariate",
        "n_series": 2
      },
      "output": {
        "status": "need_data_property",
        "missing_property": "integration_orders",